{
  "schemaVersion": "1.0.0",
  "storeId": "22222222-2222-4222-8222-222222222222",
  "deviceId": "33333333-3333-4333-8333-333333333333",
  "createdAt": "2026-08-25T08:00:00Z",
  "updatedAt": "2026-08-25T08:10:00Z",
  "activeClientId": "11111111-1111-4111-8111-111111111111",
  "clients": [
    {
      "clientId": "11111111-1111-4111-8111-111111111111",
      "relativeDirectory": "clients/11111111-1111-4111-8111-111111111111",
      "status": "ACTIVE",
      "createdAt": "2026-08-25T08:00:00Z"
    }
  ]
}
